{
    "$schema": "../metadata.schema.json",
    "name": "coffee",
    "version": "0.1.0",
    "contributors": [
        "jmjuanes"
    ],
    "categories": [],
    "tags": [
        "coffee",
        "drink",
        "morning",
        "hot",
        "cup",
        "expresso",
        "latte",
        "cafe",
        "mug"
    ]
}