{
    "$schema": "../metadata.schema.json",
    "name": "arrows-split",
    "version": "0.2.0",
    "contributors": [
        "jmjuanes"
    ],
    "categories": [],
    "tags": [
        "arrows",
        "direction",
        "navigation",
        "split",
        "divide",
        "separate"
    ]
}