{
    "$schema": "../metadata.schema.json",
    "name": "sd-card",
    "version": "0.4.0",
    "contributors": [
        "jmjuanes"
    ],
    "categories": [],
    "tags": [
        "sd",
        "card",
        "data",
        "disk",
        "information",
        "photos",
        "images",
        "media"
    ]
}