{
    "$schema": "../metadata.schema.json",
    "name": "chart-area",
    "version": "0.1.0",
    "contributors": [
        "jmjuanes"
    ],
    "categories": [],
    "tags": [
        "chart",
        "area",
        "data",
        "diagram",
        "statistics",
        "graph",
        "analysis"
    ]
}