{
    "$schema": "../metadata.schema.json",
    "name": "car-front",
    "version": "0.4.0",
    "contributors": [
        "jmjuanes"
    ],
    "categories": [],
    "tags": [
        "car",
        "front",
        "vehicle",
        "city",
        "transport",
        "drive",
        "journey",
        "trip"
    ]
}